{
  "schema_version": "grading-agent-v2",
  "request_id": "subjective-grade-image-0001",
  "subject": "math",
  "grade_level": "junior_middle",
  "question_id": "question-001",
  "answer_segment_id": "segment-001",
  "question_type": "calculation",
  "question_text": "Calculate 12 + 8 and show the result.",
  "max_score": 4,
  "answer_text": "12 + 8 = 20",
  "ocr_confidence": 0.96,
  "rubric_version": "rubric-v4",
  "prompt_version": "subjective-image-contract-v2",
  "rubric": {
    "rubric_id": "rubric-001",
    "rubric_version": "rubric-v4",
    "question_type": "calculation",
    "max_score": 4,
    "allow_partial_total": false,
    "points": [
      {
        "id": "p1",
        "description": "Shows the addition expression",
        "score": 2,
        "required": true,
        "aliases": ["12 + 8"],
        "evidence_required": true,
        "match_policy": "semantic"
      },
      {
        "id": "p2",
        "description": "Obtains the result 20",
        "score": 2,
        "required": true,
        "aliases": ["20"],
        "evidence_required": true,
        "match_policy": "semantic"
      }
    ],
    "deductions": [],
    "equivalent_answers": [],
    "examples": [],
    "scoring_notes": []
  },
  "model_policy": {
    "mode": "shadow",
    "model_version": "fixture-multimodal-model-v1",
    "min_confidence": 0.8
  },
  "prompt_guard": {
    "student_answer_is_untrusted": true,
    "suspected_injection": false,
    "signals": []
  },
  "output_constraint": {
    "criteria_evidence_only": true,
    "allow_model_final_score": false,
    "final_score_authority": "server_rubric_or_human_confirmation"
  },
  "math_evidence": {
    "artifact_id": "math-artifact-001",
    "artifact_version": 3,
    "correction_revision": 0,
    "exam_question_snapshot_id": "snapshot-001",
    "scoring_version": "math-rubric-score-v1",
    "overall_confidence": 0.94,
    "quality": {
      "recognition": 0.96,
      "formula": 0.95,
      "structure": 0.94,
      "verification": 0.97,
      "rubric_mapping": 0.93,
      "critical": 0.93
    },
    "steps": [
      {"id": "s1", "text": "12 + 8", "formula_ids": ["f1"], "confidence": 0.95},
      {"id": "s2", "text": "20", "formula_ids": ["f2"], "confidence": 0.94}
    ],
    "formulas": [
      {"id": "f1", "step_ids": ["s1"], "canonical_latex": "12+8", "parse_status": "parsed", "reason_codes": [], "bbox": {"x": 0.1, "y": 0.2, "width": 0.3, "height": 0.1}, "confidence": 0.95},
      {"id": "f2", "step_ids": ["s2"], "canonical_latex": "20", "parse_status": "parsed", "reason_codes": [], "bbox": {"x": 0.5, "y": 0.2, "width": 0.2, "height": 0.1}, "confidence": 0.94}
    ],
    "verifications": [
      {"id": "v1", "step_id": "s2", "formula_id": "f2", "kind": "arithmetic", "status": "verified", "reason_code": "exact_arithmetic", "confidence": 0.97}
    ],
    "rubric_evidence": [
      {"id": "re1", "rubric_criterion_key": "p1", "evidence_type": "step_present", "source_artifact_ids": ["s1"], "verification_ids": [], "status": "supported", "explanation": "verified step", "confidence": 0.95},
      {"id": "re2", "rubric_criterion_key": "p2", "evidence_type": "final_result", "source_artifact_ids": ["s2", "f2"], "verification_ids": ["v1"], "status": "supported", "explanation": "verified result", "confidence": 0.94}
    ],
    "has_diagram": false,
    "graph_uncertain": false,
    "required_rubric_uncertain": false
  },
  "media_evidence": {
    "kind": "answer_segment_crop",
    "encoding": "base64",
    "media_type": "image/png",
    "sha256": "d126d616641d42ac8b0a07ec302c9fa1ec049f86200931a0a60c8f3080284b77",
    "byte_size": 68,
    "width_pixels": 1,
    "height_pixels": 1,
    "normalized_bbox": {
      "x": 0.1,
      "y": 0.2,
      "width": 0.4,
      "height": 0.3
    },
    "binding_hash": "00dec19e6cb2f4f6ae51300bf1c3c65def2b747bca52a48f27f619c95f9d8c9d",
    "data_base64": "iVBORw0KGgoAAAANSUhEUgAAAAEAAAABCAQAAAC1HAwCAAAAC0lEQVR42mP8/x8AAusB9Y9Zl1sAAAAASUVORK5CYII="
  }
}
